{
  "schemaVersion": "nodekit.evolution-deferred-review/v1",
  "id": "deferred-review:sha256:526dd54048c8632b4518cdfdd98557145db03eb2489c95cd8f7af0019fc475f7",
  "events": [
    {
      "eventId": "evt:native-agent-session-identity",
      "draftRef": "evolution/drafts/evt-native-agent-session-identity.json",
      "draftDigest": "0b88544ff47bbb9989b86b24dd11ebe758394b591448f346c9000cf25d5e984e",
      "sourceCommit": "cc49b80bc53aeaf90bfe23562701482fb28d5958"
    },
    {
      "eventId": "evt:proof-backed-deferred-review",
      "draftRef": "evolution/drafts/evt-proof-backed-deferred-review.json",
      "draftDigest": "becf4963775fd3ef2232a179315d445945a195641d76b0d102bbf7e54abefcaf",
      "sourceCommit": "24e8b997077590a735d4962f48a4d4898a2e6c0d"
    }
  ],
  "range": {
    "from": "ab7c9e69e53e2eb1838f0d854dafb490f960537c",
    "reviewedTo": "f9cdb92742fe0a232a2a2f18e7c4b916222b8de8"
  },
  "risk": {
    "classification": "reversible",
    "effects": {
      "destructiveWrite": false,
      "credentialOrAuthorityChange": true,
      "irreversibleMigration": false,
      "materialSpend": false,
      "externalCommunication": false,
      "legalOrComplianceCommitment": false,
      "unverifiedRollback": false
    },
    "authorityDirective": {
      "ref": "evidence/autonomous-governance/operator-directive.md",
      "sha256": "0bb635948306525eb3578a2b297ff0fbd2a963a0999734cf2bc458064b346679",
      "assurance": "operator-directed-in-session"
    }
  },
  "coverage": {
    "materialFiles": [
      "schemas/nodekit.evolution-deferred-review.v1.schema.json",
      "schemas/nodekit.native-agent-session.v1.schema.json",
      "schemas/nodekit.native-session-checkpoint.v1.schema.json",
      "schemas/nodekit.native-workspace.v1.schema.json",
      "schemas/nodekit.workspace-reference-index.v1.schema.json",
      "src/cli-main.mjs",
      "src/index.d.mts",
      "src/index.mjs",
      "src/lib/caseflow.mjs",
      "src/lib/evolution-ledger.mjs",
      "src/lib/native-agent-identity.mjs",
      "src/lib/native-agent-migration.mjs",
      "src/lib/workspace-reference-index.mjs",
      "src/native-agent-identity.d.mts",
      "src/native-agent-identity.mjs",
      "src/workspace-reference-index.d.mts",
      "src/workspace-reference-index.mjs"
    ]
  },
  "evidence": {
    "before": [
      {
        "ref": "evidence/autonomous-governance/before/live-io.json",
        "sha256": "ced1f25c5076f4b823d9f66b790b9f63c7403e0d35c6faef1508cecf314aa518",
        "kind": "live-io"
      },
      {
        "ref": "evidence/autonomous-governance/before/pr-checks.json",
        "sha256": "53c7e5ede4db390b71bda8167d5da7f0bc7df012dd093d76349c71d0c3189b48",
        "kind": "ci-log"
      },
      {
        "ref": "evidence/autonomous-governance/operator-directive.md",
        "sha256": "0bb635948306525eb3578a2b297ff0fbd2a963a0999734cf2bc458064b346679",
        "kind": "operator-directive"
      }
    ],
    "after": [
      {
        "ref": "evidence/autonomous-governance/after/live-io.json",
        "sha256": "63592f9cf7cdf6711625ae92441bbff8b217b2959732ab0b539223e92bd401be",
        "kind": "live-io"
      },
      {
        "ref": "evidence/autonomous-governance/after/journey-card.md",
        "sha256": "1acc88e3c4f33c459ef254f444a2f3b48aded4ff6e7447d2a3520989ea810eba",
        "kind": "journey-card"
      },
      {
        "ref": "evidence/autonomous-governance/after/scenario-tests.log",
        "sha256": "0127f3b0b7c6373b0be9be5c9372ee518e04ddc7f44e2b560e06db24bcc59607",
        "kind": "test-log"
      },
      {
        "ref": "evidence/autonomous-governance/after/rollback-verification.json",
        "sha256": "b742b3d1e9103ded2bf5576b1837067c8a7c87a58d1a6d3b177dcb8eb05472fe",
        "kind": "test-log"
      }
    ]
  },
  "uiSurface": {
    "changed": false,
    "mediaRequired": false,
    "reason": "Package runtime only; no deployed product UI route changed. The larger human goal is shown by the journey card and exact live I/O.",
    "mediaRefs": []
  },
  "rollback": {
    "targetCommit": "ab7c9e69e53e2eb1838f0d854dafb490f960537c",
    "strategy": "git-revert-range",
    "verificationRefs": [
      "evidence/autonomous-governance/after/rollback-verification.json"
    ]
  },
  "review": {
    "status": "deferred-human-review",
    "feedbackChannel": "pull-request"
  },
  "receiptDigest": "6f04fcf6c38db66d4a234d6cc483087c7c29f7afd35842c39bfaddb17dc6aecc"
}
